{
  "$schema": "https://json-schema.org/draft/2020-12/schema",
  "$id": "https://skp.dev/schemas/1/template.schema.json",
  "title": "SKP template manifest (template.json)",
  "type": "object",
  "required": ["standard", "id", "name", "version", "category", "entry", "previews", "canvases", "scenes"],
  "properties": {
    "standard": { "const": "skp/1" },
    "id": { "type": "string", "pattern": "^[a-z0-9]+(\\.[a-z0-9-]+){2,}$", "maxLength": 100, "description": "Reverse-DNS, immutable." },
    "name": { "type": "string", "minLength": 1, "maxLength": 80 },
    "version": {
      "type": "string", "maxLength": 64,
      "pattern": "^(0|[1-9]\\d*)\\.(0|[1-9]\\d*)\\.(0|[1-9]\\d*)(?:-((?:0|[1-9]\\d*|\\d*[a-zA-Z-][0-9a-zA-Z-]*)(?:\\.(?:0|[1-9]\\d*|\\d*[a-zA-Z-][0-9a-zA-Z-]*))*))?$",
      "description": "Strict SemVer 2.0.0, without build metadata."
    },
    "description": { "type": "string", "maxLength": 500 },
    "author": {
      "type": "object", "required": ["name"],
      "properties": { "name": { "type": "string" }, "url": { "type": "string", "format": "uri" } }
    },
    "license": { "type": "string" },
    "category": { "enum": ["show", "chat", "alerts", "now-playing", "lower-third", "background", "ticker", "goal", "scoreboard", "widget"] },
    "tags": { "type": "array", "items": { "type": "string" }, "maxItems": 12 },
    "entry": { "type": "string", "default": "index.html" },
    "previews": { "type": "array", "minItems": 1, "maxItems": 20, "items": { "type": "string" } },
    "engines": { "type": "object", "properties": { "obs": { "type": "string" } } },
    "canvases": {
      "type": "array", "minItems": 1, "maxItems": 8,
      "items": {
        "type": "object", "required": ["id", "width", "height"],
        "properties": {
          "id": { "type": "string", "pattern": "^[a-z0-9-]+$", "maxLength": 32 },
          "width": { "type": "integer", "minimum": 64, "maximum": 7680 },
          "height": { "type": "integer", "minimum": 64, "maximum": 7680 },
          "default": { "type": "boolean" }
        }
      }
    },
    "scenes": {
      "type": "array", "minItems": 1, "maxItems": 100,
      "items": {
        "type": "object", "required": ["id", "label"],
        "properties": {
          "id": { "type": "string", "pattern": "^[a-z][a-z0-9-]*$", "maxLength": 64 },
          "label": { "type": "string", "maxLength": 80 },
          "core": { "enum": ["auto", "starting", "program", "brb", "lineup", "outro", "bg", "intro"] },
          "transparent": { "type": "boolean" },
          "durationMs": { "type": "integer", "minimum": 0 },
          "then": { "type": "string", "description": "A scene id or a core of this template, returned to after durationMs." }
        },
        "dependentRequired": { "then": ["durationMs"] }
      }
    },
    "consumes": {
      "type": "object",
      "properties": {
        "state": { "type": "array", "maxItems": 64, "items": { "type": "string", "maxLength": 128 } },
        "events": { "type": "array", "maxItems": 64, "items": { "type": "string", "maxLength": 128 } },
        "chat": {
          "type": "object",
          "properties": {
            "recent": { "type": "integer", "minimum": 0, "maximum": 200 },
            "max": { "type": "integer", "minimum": 1, "maximum": 200 }
          }
        }
      }
    },
    "settings": { "type": "object", "description": "JSON Schema (2020-12 subset) with x-skp-* extensions, 04 §4.3." },
    "actions": {
      "type": "array", "maxItems": 100,
      "items": {
        "type": "object", "required": ["id", "label"],
        "properties": {
          "id": { "type": "string", "pattern": "^[a-zA-Z][a-zA-Z0-9]*$", "maxLength": 64 },
          "label": { "type": "string", "maxLength": 80 },
          "durationMs": { "type": "integer", "minimum": 0 },
          "args": { "type": "object" }
        }
      }
    },
    "alerts": {
      "type": "object",
      "properties": {
        "mode": { "enum": ["serial", "stack"] },
        "maxConcurrent": { "type": "integer", "minimum": 1, "maximum": 10 },
        "durationMs": { "type": "integer", "minimum": 1000, "maximum": 60000 },
        "durationSetting": { "type": "string", "description": "Name of a numeric setting (ms) that overrides durationMs (05 §5.5); if it names none, durationMs is used." },
        "gapMs": { "type": "integer", "minimum": 0 },
        "maxQueue": { "type": "integer", "minimum": 1 },
        "coalesce": { "type": "boolean" }
      }
    },
    "transitions": {
      "type": "array", "maxItems": 32,
      "items": {
        "type": "object", "required": ["id"],
        "properties": { "id": { "type": "string", "minLength": 1, "maxLength": 64 }, "media": { "type": "string" }, "cutAtMs": { "type": "integer", "minimum": 0 } }
      }
    },
    "fonts": { "type": "array", "maxItems": 8, "items": { "type": "string", "format": "uri", "maxLength": 2048 } },
    "definitions": { "type": "object" }
  }
}
